{
  "schema_version": "review-result/v1",
  "task_id": "example-timeout",
  "run_id": "example-timeout-1",
  "input_digests": {
    "snapshot": "aaaaaaaaaaaaaaaaaaaaaaaaaaaaaaaaaaaaaaaaaaaaaaaaaaaaaaaaaaaaaaaa",
    "diff": "bbbbbbbbbbbbbbbbbbbbbbbbbbbbbbbbbbbbbbbbbbbbbbbbbbbbbbbbbbbbbbbb",
    "policy": "cccccccccccccccccccccccccccccccccccccccccccccccccccccccccccccccc"
  },
  "outcome": "partial",
  "findings": [],
  "rejected_findings": [],
  "usage": { "input_tokens": 10, "output_tokens": 0, "tool_calls": 0 },
  "errors": [{ "code": "timeout", "message": "The model adapter timed out." }],
  "artifacts": []
}
